id,name,parent,group,account,type,percentage,invoice_account,credit_note_account,invoice_base_code,invoice_tax_code,invoice_base_code,credit_note_tax_code,invoice_base_sign,invoice_tax_sign,credit_note_base_sign,credit_note_tax_sign,sequence
tax_1040101,IVA VENTAS LOCALES (EXCLUYE ACTIVOS FIJOS) GRAVADAS TARIFA 12%,,tax_group_sale,pc,percentage,Decimal('12.0'),pc_20107010101,pc_20107010101,taxcode_1040101,taxcode_1040119,taxcode_1040101,taxcode_1040119,1,1,-1,-1,
tax_1040102,IVA VENTAS DE ACTIVOS FIJOS GRAVADAS TARIFA 12%,,tax_group_sale,pc,percentage,Decimal('12.0'),pc_20107010102,pc_20107010102,taxcode_1040102,taxcode_1040120,taxcode_1040102,taxcode_1040120,1,1,-1,-1,
tax_1040103,IVA VENTAS LOCALES (EXCLUYE ACTIVOS FIJOS) GRAVADAS TARIFA 0% QUE NO DAN DERECHO A CREDITO TRIBUTARIO,,tax_group_sale,pc,percentage,Decimal('0.0'),pc_20107010103,pc_20107010103,taxcode_1040103,taxcode_1040121,taxcode_1040103,taxcode_1040121,1,1,-1,-1,
tax_1040104,IVA VENTAS DE ACTIVOS FIJOS GRAVADAS TARIFA 0% QUE NO DAN DERECHO A CREDITO TRIBUTARIO,,tax_group_sale,pc,percentage,Decimal('0.0'),pc_20107010104,pc_20107010104,taxcode_1040104,taxcode_1040121,taxcode_1040104,taxcode_1040121,1,1,-1,-1,
tax_1040105,IVA VENTAS LOCALES (EXCLUYE ACTIVOS FIJOS) GRAVADAS TARIFA 0% QUE DAN DERECHO A CREDITO TRIBUTARIO,,tax_group_sale,pc,percentage,Decimal('0.0'),pc_20107010105,pc_20107010105,taxcode_1040105,taxcode_1040121,taxcode_1040105,taxcode_1040121,1,1,-1,-1,
tax_1040106,IVA VENTAS DE ACTIVOS FIJOS GRAVADAS TARIFA 0% QUE DAN DERECHO A CREDITO TRIBUTARIO,,tax_group_sale,pc,percentage,Decimal('0.0'),pc_20107010106,pc_20107010106,taxcode_1040106,taxcode_1040121,taxcode_1040106,taxcode_1040121,1,1,-1,-1,
tax_1040107,IVA EXPORTACIONES DE BIENES,,tax_group_sale,pc,none,,pc_20107010107,pc_20107010107,taxcode_1040107,taxcode_1040121,taxcode_1040107,taxcode_1040121,1,1,-1,-1,
tax_1040108,IVA EXPORTACIONES DE SERVICIOS,,tax_group_sale,pc,none,,pc_20107010108,pc_20107010108,taxcode_1040108,taxcode_1040121,taxcode_1040108,taxcode_1040121,1,1,-1,-1,
tax_1040109,TRANSFERENCIAS NO OBJETO O EXENTAS DE IVA,,tax_group_sale,pc,none,,pc_20107010109,pc_20107010109,taxcode_1040109,taxcode_1040121,taxcode_1040109,taxcode_1040121,1,1,-1,-1,
tax_1040201,IVA ADQUISICIONES Y PAGOS (EXCLUYE ACTIVOS FIJOS) GRAVADOS TARIFA 12% (CON DERECHO A CRÉDITO TRIBUTARIO),,tax_group_purchase,pc,percentage,Decimal('12.0'),pc_10108010101,pc_10108010101,taxcode_1040201,taxcode_1040223,taxcode_1040201,taxcode_1040223,1,1,-1,-1,
tax_1040202,IVA ADQUISICIONES LOCALES DE ACTIVOS FIJOS GRAVADOS TARIFA 12% (CON DERECHO A CRÉDITO TRIBUTARIO),,tax_group_purchase,pc,percentage,Decimal('12.0'),pc_10108010102,pc_10108010102,taxcode_1040202,taxcode_1040224,taxcode_1040202,taxcode_1040224,1,1,-1,-1,
tax_1040203,IVA OTRAS ADQUISICIONES Y PAGOS GRAVADOS TARIFA 12% (SIN DERECHO A CRÉDITO TRIBUTARIO),,tax_group_purchase,pc,percentage,Decimal('12.0'),pc_10108010103,pc_10108010103,taxcode_1040203,taxcode_1040225,taxcode_1040203,taxcode_1040225,1,1,-1,-1,
tax_1040204,IVA IMPORTACIONES DE SERVICIOS GRAVADOS TARIFA 12%,,tax_group_purchase,pc,percentage,Decimal('12.0'),pc_10108010104,pc_10108010104,taxcode_1040204,taxcode_1040226,taxcode_1040204,taxcode_1040226,1,1,-1,-1,
tax_1040205,IVA IMPORTACIONES DE BIENES (EXCLUYE ACTIVOS FIJOS) GRAVADOS TARIFA 12%,,tax_group_purchase,pc,percentage,Decimal('12.0'),pc_10108010105,pc_10108010105,taxcode_1040205,taxcode_1040227,taxcode_1040205,taxcode_1040227,1,1,-1,-1,
tax_1040206,IVA IMPORTACIONES DE ACTIVOS FIJOS GRAVADOS TARIFA 12%,,tax_group_purchase,pc,percentage,Decimal('12.0'),pc_10108010106,pc_10108010106,taxcode_1040206,taxcode_1040228,taxcode_1040206,taxcode_1040228,1,1,-1,-1,
tax_1040207,IVA IMPORTACIONES DE BIENES (INCLUYE ACTIVOS FIJOS) GRAVADOS TARIFA 0%,,tax_group_purchase,pc,percentage,Decimal('0.0'),pc_10108010107,pc_10108010107,taxcode_1040207,taxcode_1040230,taxcode_1040207,taxcode_1040230,1,1,-1,-1,
tax_1040208,IVA ADQUISICIONES Y PAGOS (INCLUYE ACTIVOS FIJOS) GRAVADOS TARIFA 0%,,tax_group_purchase,pc,percentage,Decimal('0.0'),pc_10108010108,pc_10108010108,taxcode_1040208,taxcode_1040230,taxcode_1040208,taxcode_1040230,1,1,-1,-1,
tax_1040209,ADQUISICIONES REALIZADAS A CONTRIBUYENTES RISE ,,tax_group_purchase,pc,percentage,Decimal('0.0'),pc_10108010109,pc_10108010109,taxcode_1040209,taxcode_1040230,taxcode_1040209,taxcode_1040230,1,1,-1,-1,
tax_1040210,ADQUISICIONES NO OBJETO DE IVA,,tax_group_purchase,pc,percentage,Decimal('0.0'),pc_10108010110,pc_10108010110,taxcode_1040210,taxcode_1040230,taxcode_1040210,taxcode_1040230,1,1,-1,-1,
tax_1040211,ADQUISICIONES EXENTAS DEL PAGO DE IVA,,tax_group_purchase,pc,percentage,Decimal('0.0'),pc_10108010111,pc_10108010111,taxcode_1040211,taxcode_1040230,taxcode_1040211,taxcode_1040230,1,1,-1,-1,
tax_1040212,ANTICIPO RETENCION IVA 10%,,tax_group_sale,pc,percentage,Decimal('-10.0'),pc_101050101,pc_101050101,taxcode_1040119,taxcode_1040301,taxcode_1040119,taxcode_1040301,1,1,-1,-1,
tax_1040213,ANTICIPO RETENCION IVA 20%,,tax_group_sale,pc,percentage,Decimal('-20.0'),pc_101050102,pc_101050102,taxcode_1040119,taxcode_1040302,taxcode_1040119,taxcode_1040302,1,1,-1,-1,
tax_1040214,ANTICIPO RETENCION IVA 30%,,tax_group_sale,pc,percentage,Decimal('-30.0'),pc_101050103,pc_101050103,taxcode_1040119,taxcode_1040303,taxcode_1040119,taxcode_1040303,1,1,-1,-1,
tax_1040215,ANTICIPO RETENCION IVA 70%,,tax_group_sale,pc,percentage,Decimal('-70.0'),pc_101050104,pc_101050104,taxcode_1040119,taxcode_1040304,taxcode_1040119,taxcode_1040304,1,1,-1,-1,
tax_1040216,ANTICIPO RETENCION IVA 100%,,tax_group_sale,pc,percentage,Decimal('-100.0'),pc_101050105,pc_101050105,taxcode_1040119,taxcode_1040305,taxcode_1040119,taxcode_1040305,1,1,-1,-1,
tax_104022901,ANTICIPO RETENCION EN LA FUENTE 1%,,tax_group_sale,pc,percentage,Decimal('-1.0'),pc_101050201,pc_101050201,taxcode_1040101,taxcode_1040229,taxcode_1040101,taxcode_1040229,1,1,-1,-1,
tax_104022902,ANTICIPO RETENCION EN LA FUENTE 2%,,tax_group_sale,pc,percentage,Decimal('-2.0'),pc_101050202,pc_101050202,taxcode_1040101,taxcode_1040229,taxcode_1040101,taxcode_1040229,1,1,-1,-1,
tax_104022903,ANTICIPO RETENCION EN LA FUENTE 8%,,tax_group_sale,pc,percentage,Decimal('-8.0'),pc_101050203,pc_101050203,taxcode_1040101,taxcode_1040229,taxcode_1040101,taxcode_1040229,1,1,-1,-1,
tax_104022904,ANTICIPO RETENCION EN LA FUENTE 10%,,tax_group_sale,pc,percentage,Decimal('-10.0'),pc_101050204,pc_101050204,taxcode_1040101,taxcode_1040229,taxcode_1040101,taxcode_1040229,1,1,-1,-1,
tax_302,EN RELACIÓN DE DEPENDENCIA QUE SUPERA O NO LA BASE DESGRAVADA - BASE IMPONIBLE,,tax_group_purchase,pc,percentage,Decimal('-10.0'),pc_20107010201,pc_20107010201,taxcode_1030101,taxcode_1030138,taxcode_1030101,taxcode_1030138,1,1,-1,-1,
tax_303,HONORARIOS PROFESIONALES Y DEMÁS PAGOS POR SERVICIOS RELACIONADOS CON EL TÍTULO PROFESIONAL 10%  (303),,tax_group_purchase,pc,percentage,Decimal('-10.0'),pc_20107010202,pc_20107010202,taxcode_1030102,taxcode_1030139,taxcode_1030102,taxcode_1030139,1,1,-1,-1,
tax_304,SERVICIOS PREDOMINA EL INTELECTO NO RELACIONADOS CON EL TÍTULO PROFESIONAL 8% (304),,tax_group_purchase,pc,percentage,Decimal('-8.0'),pc_20107010203,pc_20107010203,taxcode_1030103,taxcode_1030140,taxcode_1030103,taxcode_1030140,1,1,-1,-1,
tax_304A,COMISIONES Y DEMÁS PAGOS POR SERVICIOS PREDOMINA INTELECTO NO RELACIONADOS CON EL TÍTULO PROFESIONAL  8%  (304A),,tax_group_purchase,pc,percentage,Decimal('-8.0'),pc_20107010204,pc_20107010204,taxcode_1030103,taxcode_1030140,taxcode_1030103,taxcode_1030140,1,1,-1,-1,
tax_304B,PAGOS A NOTARIOS Y REGISTRADORES DE LA PROPIEDAD Y MERCANTIL POR SUS ACTIVIDADES EJERCIDAS COMO TALES  8% (304B),,tax_group_purchase,pc,percentage,Decimal('-8.0'),pc_20107010205,pc_20107010205,taxcode_1030103,taxcode_1030140,taxcode_1030103,taxcode_1030140,1,1,-1,-1,
tax_304C,"PAGOS A DEPORTISTAS, ENTRENADORES, ÁRBITROS, MIEMBROS DEL CUERPO TÉCNICO POR SUS ACTIVIDADES EJERCIDAS COMO TALES  8%  (304C)",,tax_group_purchase,pc,percentage,Decimal('-8.0'),pc_20107010206,pc_20107010206,taxcode_1030103,taxcode_1030140,taxcode_1030103,taxcode_1030140,1,1,-1,-1,
tax_304D,PAGOS A ARTISTAS POR SUS ACTIVIDADES EJERCIDAS COMO TALES  8%  (304D),,tax_group_purchase,pc,percentage,Decimal('-8.0'),pc_20107010207,pc_20107010207,taxcode_1030103,taxcode_1030140,taxcode_1030103,taxcode_1030140,1,1,-1,-1,
tax_304E,HONORARIOS Y DEMÁS PAGOS POR SERVICIOS DE DOCENCIA  8% (304E),,tax_group_purchase,pc,percentage,Decimal('-8.0'),pc_20107010208,pc_20107010208,taxcode_1030103,taxcode_1030140,taxcode_1030103,taxcode_1030140,1,1,-1,-1,
tax_307,SERVICIOS PREDOMINA LA MANO DE OBRA  2% (307),,tax_group_purchase,pc,percentage,Decimal('-2.0'),pc_20107010209,pc_20107010209,taxcode_1030104,taxcode_1030141,taxcode_1030104,taxcode_1030141,1,1,-1,-1,
tax_308,UTILIZACIÓN O APROVECHAMIENTO DE LA IMAGEN O RENOMBRE 10% (308),,tax_group_purchase,pc,percentage,Decimal('-10.0'),pc_20107010210,pc_20107010210,taxcode_1030105,taxcode_1030142,taxcode_1030105,taxcode_1030142,1,1,-1,-1,
tax_309,SERVICIOS PRESTADOS POR MEDIOS DE COMUNICACIÓN Y AGENCIAS DE PUBLICIDAD 1% (309),,tax_group_purchase,pc,percentage,Decimal('-1.0'),pc_20107010211,pc_20107010211,taxcode_1030106,taxcode_1030143,taxcode_1030106,taxcode_1030143,1,1,-1,-1,
tax_310,SERVICIO DE TRANSPORTE PRIVADO DE PASAJEROS O TRANSPORTE PÚBLICO O PRIVADO DE CARGA 1% (310),,tax_group_purchase,pc,percentage,Decimal('-1.0'),pc_20107010212,pc_20107010212,taxcode_1030107,taxcode_1030144,taxcode_1030107,taxcode_1030144,1,1,-1,-1,
tax_311,POR PAGOS A TRAVÉS DE LIQUIDACIÓN DE COMPRA (NIVEL CULTURAL O RUSTICIDAD) 2%  (311),,tax_group_purchase,pc,percentage,Decimal('-2.0'),pc_20107010213,pc_20107010213,taxcode_1030108,taxcode_1030145,taxcode_1030108,taxcode_1030145,1,1,-1,-1,
tax_312,TRANSFERENCIA DE BIENES MUEBLES DE NATURALEZA CORPORAL 1% (312),,tax_group_purchase,pc,percentage,Decimal('-1.0'),pc_20107010214,pc_20107010214,taxcode_1030109,taxcode_1030146,taxcode_1030109,taxcode_1030146,1,1,-1,-1,
tax_312A,"COMPRA DE BIENES DE ORIGEN AGRÍCOLA, AVÍCOLA, PECUARIO, APÍCOLA, CUNÍCULA, BIOACUÁTICO, Y FORESTAL 1% (312A)",,tax_group_purchase,pc,percentage,Decimal('-1.0'),pc_20107010215,pc_20107010215,taxcode_1030109,taxcode_1030146,taxcode_1030109,taxcode_1030146,1,1,-1,-1,
tax_314A,REGALÍAS POR CONCEPTO DE FRANQUICIAS DE ACUERDO A LEY DE PROPIEDAD INTELECTUAL - PAGO A PERSONAS NATURALES  8%  (314A) ,,tax_group_purchase,pc,percentage,Decimal('-8.0'),pc_20107010216,pc_20107010216,taxcode_1030110,taxcode_1030147,taxcode_1030110,taxcode_1030147,1,1,-1,-1,
tax_314B,"CÁNONES, DERECHOS DE AUTOR,  MARCAS, PATENTES Y SIMILARES DE ACUERDO A LEY DE PROPIEDAD INTELECTUAL – PAGO A PERSONAS NATURALES  8%  (314B)",,tax_group_purchase,pc,percentage,Decimal('-8.0'),pc_20107010217,pc_20107010217,taxcode_1030110,taxcode_1030147,taxcode_1030110,taxcode_1030147,1,1,-1,-1,
tax_314C,REGALÍAS POR CONCEPTO DE FRANQUICIAS DE ACUERDO A LEY DE PROPIEDAD INTELECTUAL  - PAGO A SOCIEDADES  8%  (314C),,tax_group_purchase,pc,percentage,Decimal('-8.0'),pc_20107010218,pc_20107010218,taxcode_1030110,taxcode_1030147,taxcode_1030110,taxcode_1030147,1,1,-1,-1,
tax_314D,"CÁNONES, DERECHOS DE AUTOR,  MARCAS, PATENTES Y SIMILARES DE ACUERDO A LEY DE PROPIEDAD INTELECTUAL – PAGO A SOCIEDADES  8%  (314D)",,tax_group_purchase,pc,percentage,Decimal('-8.0'),pc_20107010219,pc_20107010219,taxcode_1030110,taxcode_1030147,taxcode_1030110,taxcode_1030147,1,1,-1,-1,
tax_319,"CUOTAS DE ARRENDAMIENTO MERCANTIL, INCLUSIVE LA DE OPCIÓN DE COMPRA  1%  (319)",,tax_group_purchase,pc,percentage,Decimal('-1.0'),pc_20107010220,pc_20107010220,taxcode_1030111,taxcode_1030148,taxcode_1030111,taxcode_1030148,1,1,-1,-1,
tax_320,POR ARRENDAMIENTO BIENES INMUEBLES  8%  (320),,tax_group_purchase,pc,percentage,Decimal('-8.0'),pc_20107010221,pc_20107010221,taxcode_1030112,taxcode_1030149,taxcode_1030112,taxcode_1030149,1,1,-1,-1,
tax_322,SEGUROS Y REASEGUROS (PRIMAS Y CESIONES) 1% (322),,tax_group_purchase,pc,percentage,Decimal('-1.0'),pc_20107010222,pc_20107010222,taxcode_1030113,taxcode_1030150,taxcode_1030113,taxcode_1030150,1,1,-1,-1,
tax_323,POR RENDIMIENTOS FINANCIEROS PAGADOS A NATURALES Y SOCIEDADES  (NO A IFIS) 2%   (323),,tax_group_purchase,pc,percentage,Decimal('-2.0'),pc_20107010223,pc_20107010223,taxcode_1030114,taxcode_1030151,taxcode_1030114,taxcode_1030151,1,1,-1,-1,
tax_323A,POR RF: DEPÓSITOS CTA. CORRIENTE 2%  (323A),,tax_group_purchase,pc,percentage,Decimal('-2.0'),pc_20107010224,pc_20107010224,taxcode_1030114,taxcode_1030151,taxcode_1030114,taxcode_1030151,1,1,-1,-1,
tax_323B1,POR RF:  DEPÓSITOS CTA. AHORROS SOCIEDADES 2%  (323B1),,tax_group_purchase,pc,percentage,Decimal('-2.0'),pc_20107010225,pc_20107010225,taxcode_1030114,taxcode_1030151,taxcode_1030114,taxcode_1030151,1,1,-1,-1,
tax_323E,POR RF: DEPÓSITO A PLAZO FIJO  GRAVADOS 2%  (323E),,tax_group_purchase,pc,percentage,Decimal('-2.0'),pc_20107010226,pc_20107010226,taxcode_1030114,taxcode_1030151,taxcode_1030114,taxcode_1030151,1,1,-1,-1,
tax_323E2,POR RF: DEPÓSITO A PLAZO FIJO EXENTOS  0%  (323E2),,tax_group_purchase,pc,percentage,Decimal('0.0'),pc_20107010227,pc_20107010227,taxcode_1030114,taxcode_1030151,taxcode_1030114,taxcode_1030151,1,1,-1,-1,
tax_323F,POR RENDIMIENTOS FINANCIEROS: OPERACIONES DE REPORTO - REPOS 2%  (323F),,tax_group_purchase,pc,percentage,Decimal('-2.0'),pc_20107010228,pc_20107010228,taxcode_1030114,taxcode_1030151,taxcode_1030114,taxcode_1030151,1,1,-1,-1,
tax_323G,POR RF: INVERSIONES (CAPTACIONES) RENDIMIENTOS DISTINTOS DE AQUELLOS PAGADOS A IFIS 2%  (323G),,tax_group_purchase,pc,percentage,Decimal('-2.0'),pc_20107010229,pc_20107010229,taxcode_1030114,taxcode_1030151,taxcode_1030114,taxcode_1030151,1,1,-1,-1,
tax_323H,POR RF: OBLIGACIONES 2%  (323H),,tax_group_purchase,pc,percentage,Decimal('-2.0'),pc_20107010230,pc_20107010230,taxcode_1030114,taxcode_1030151,taxcode_1030114,taxcode_1030151,1,1,-1,-1,
tax_323I,POR RF: BONOS CONVERTIBLE EN ACCIONES 2%  (323I),,tax_group_purchase,pc,percentage,Decimal('-2.0'),pc_20107010231,pc_20107010231,taxcode_1030114,taxcode_1030151,taxcode_1030114,taxcode_1030151,1,1,-1,-1,
tax_323M,POR RF: INVERSIONES EN TÍTULOS VALORES EN RENTA FIJA GRAVADOS 2%   (323M),,tax_group_purchase,pc,percentage,Decimal('-2.0'),pc_20107010232,pc_20107010232,taxcode_1030114,taxcode_1030151,taxcode_1030114,taxcode_1030151,1,1,-1,-1,
tax_323N,POR RF: INVERSIONES EN TÍTULOS VALORES EN RENTA FIJA EXENTOS 2% (323N),,tax_group_purchase,pc,percentage,Decimal('-2.0'),pc_20107010233,pc_20107010233,taxcode_1030114,taxcode_1030151,taxcode_1030114,taxcode_1030151,1,1,-1,-1,
tax_323O,POR RF: INTERESES PAGADOS A BANCOS Y OTRAS ENTIDADES SOMETIDAS AL CONTROL DE LA SUPERINTENDENCIA DE BANCOS Y DE LA ECONOMÍA POPULAR Y SOLIDARIA 2% (323O),,tax_group_purchase,pc,percentage,Decimal('-2.0'),pc_20107010234,pc_20107010234,taxcode_1030114,taxcode_1030151,taxcode_1030114,taxcode_1030151,1,1,-1,-1,
tax_323P,POR RF: INTERESES PAGADOS POR ENTIDADES DEL SECTOR PÚBLICO A FAVOR DE SUJETOS PASIVOS 2%  (323P),,tax_group_purchase,pc,percentage,Decimal('-2.0'),pc_20107010235,pc_20107010235,taxcode_1030114,taxcode_1030151,taxcode_1030114,taxcode_1030151,1,1,-1,-1,
tax_323Q,POR RF: OTROS INTERESES Y RENDIMIENTOS FINANCIEROS GRAVADOS 2%  (323Q),,tax_group_purchase,pc,percentage,Decimal('-2.0'),pc_20107010236,pc_20107010236,taxcode_1030114,taxcode_1030151,taxcode_1030114,taxcode_1030151,1,1,-1,-1,
tax_323R,POR RF: OTROS INTERESES Y RENDIMIENTOS FINANCIEROS EXENTOS (323R),,tax_group_purchase,pc,none,,pc_20107010237,pc_20107010237,taxcode_1030114,taxcode_1030151,taxcode_1030114,taxcode_1030151,1,1,-1,-1,
tax_324A,POR RF: INTERESES EN OPERACIONES DE CRÉDITO ENTRE INSTITUCIONES DEL SISTEMA FINANCIERO Y ENTIDADES ECONOMÍA POPULAR Y SOLIDARIA.  1%  (324A),,tax_group_purchase,pc,percentage,Decimal('-1.0'),pc_20107010238,pc_20107010238,taxcode_1030115,taxcode_1030152,taxcode_1030115,taxcode_1030152,1,1,-1,-1,
tax_324B,POR RF: POR INVERSIONES ENTRE INSTITUCIONES DEL SISTEMA FINANCIERO Y ENTIDADES ECONOMÍA POPULAR Y SOLIDARIA.  1%   (324B),,tax_group_purchase,pc,percentage,Decimal('-1.0'),pc_20107010239,pc_20107010239,taxcode_1030115,taxcode_1030152,taxcode_1030115,taxcode_1030152,1,1,-1,-1,
tax_325,ANTICIPO DIVIDENDOS  22%  (325),,tax_group_purchase,pc,percentage,Decimal('-22.0'),pc_20107010240,pc_20107010240,taxcode_1030116,taxcode_1030153,taxcode_1030116,taxcode_1030153,1,1,-1,-1,
tax_325A,"DIVIDENDOS ANTICIPADOS PRÉSTAMOS ACCIONISTAS, BENEFICIARIOS O PARTÌCIPES  22%  (325A)",,tax_group_purchase,pc,percentage,Decimal('-22.0'),pc_20107010241,pc_20107010241,taxcode_1030116,taxcode_1030153,taxcode_1030116,taxcode_1030153,1,1,-1,-1,
tax_326,DIVIDENDOS DISTRIBUIDOS QUE CORRESPONDAN AL IMPUESTO A LA RENTA ÚNICO  ESTABLECIDO EN EL ART. 27 DE LA LRTI  - HASTA EL 100% (326),,tax_group_purchase,pc,percentage,Decimal('-0.1'),pc_20107010242,pc_20107010242,taxcode_1030117,taxcode_1030154,taxcode_1030117,taxcode_1030154,1,1,-1,-1,
tax_327,DIVIDENDOS DISTRIBUIDOS A PERSONAS NATURALES RESIDENTES 1% AL 13% (327),,tax_group_purchase,pc,percentage,Decimal('-1.0'),pc_20107010243,pc_20107010243,taxcode_1030118,taxcode_1030155,taxcode_1030118,taxcode_1030155,1,1,-1,-1,
tax_328,DIVIDENDOS DISTRIBUIDOS A SOCIEDADES RESIDENTES HASTA EL 100%  (328),,tax_group_purchase,pc,percentage,Decimal('-0.1'),pc_20107010244,pc_20107010244,taxcode_1030119,taxcode_1030156,taxcode_1030119,taxcode_1030156,1,1,-1,-1,
tax_329,DIVIDENDOS DISTRIBUIDOS A FIDEICOMISOS RESIDENTES  HASTA EL 100%(329),,tax_group_purchase,pc,percentage,Decimal('-0.1'),pc_20107010245,pc_20107010245,taxcode_1030120,taxcode_1030157,taxcode_1030120,taxcode_1030157,1,1,-1,-1,
tax_330,DIVIDENDOS GRAVADOS DISTRIBUIDOS EN ACCIONES (REINVERSIÓN DE UTILIDADES SIN DERECHO A REDUCCIÓN TARIFA IR) DE ACUERDO A LA TABLA DE RETENCIONES DEL ART. 15 RALRTI (330),,tax_group_purchase,pc,percentage,Decimal('-0.1'),pc_20107010246,pc_20107010246,taxcode_1030121,taxcode_1030158,taxcode_1030121,taxcode_1030158,1,1,-1,-1,
tax_331,DIVIDENDOS EXENTOS DISTRIBUIDOS EN ACCIONES (REINVERSIÓN DE UTILIDADES CON DERECHO A REDUCCIÓN TARIFA IR)   0% (331),,tax_group_purchase,pc,percentage,Decimal('0.0'),pc_20107010247,pc_20107010247,taxcode_1030122,,taxcode_1030122,,1,1,-1,-1,
tax_332,OTRAS COMPRAS DE BIENES Y SERVICIOS NO SUJETAS A RETENCIÓN (332),,tax_group_purchase,pc,none,,pc_20107010248,pc_20107010248,taxcode_1030123,,taxcode_1030123,,1,1,-1,-1,
tax_332A,POR LA ENAJENACIÓN OCASIONAL DE ACCIONES O PARTICIPACIONES Y TÍTULOS VALORES 0% (332A),,tax_group_purchase,pc,percentage,Decimal('0.0'),pc_20107010249,pc_20107010249,taxcode_1030123,,taxcode_1030123,,1,1,-1,-1,
tax_332B,COMPRA DE BIENES INMUEBLES 0% (332B),,tax_group_purchase,pc,percentage,Decimal('0.0'),pc_20107010250,pc_20107010250,taxcode_1030123,,taxcode_1030123,,1,1,-1,-1,
tax_332C,TRANSPORTE PÚBLICO DE PASAJEROS 0% (332C),,tax_group_purchase,pc,percentage,Decimal('0.0'),pc_20107010251,pc_20107010251,taxcode_1030123,,taxcode_1030123,,1,1,-1,-1,
tax_332D,"PAGOS EN EL PAÍS POR TRANSPORTE DE PASAJEROS O TRANSPORTE INTERNACIONAL DE CARGA, A COMPAÑÍAS NACIONALES O EXTRANJERAS DE AVIACIÓN O MARÍTIMAS 0% (332D)",,tax_group_purchase,pc,percentage,Decimal('0.0'),pc_20107010252,pc_20107010252,taxcode_1030123,,taxcode_1030123,,1,1,-1,-1,
tax_332E,VALORES ENTREGADOS POR LAS COOPERATIVAS DE TRANSPORTE A SUS SOCIOS 0% (332E),,tax_group_purchase,pc,percentage,Decimal('0.0'),pc_20107010253,pc_20107010253,taxcode_1030123,,taxcode_1030123,,1,1,-1,-1,
tax_332F,COMPRAVENTA DE DIVISAS DISTINTAS AL DÓLAR DE LOS ESTADOS UNIDOS DE AMÉRICA  0% (332F),,tax_group_purchase,pc,percentage,Decimal('0.0'),pc_20107010254,pc_20107010254,taxcode_1030123,,taxcode_1030123,,1,1,-1,-1,
tax_332G,PAGOS CON TARJETA DE CRÉDITO (NO APLICA RETENCIÓN) (332G),,tax_group_purchase,pc,none,,pc_20107010255,pc_20107010255,taxcode_1030123,,taxcode_1030123,,1,1,-1,-1,
tax_332H,"PAGO AL EXTERIOR TARJETA DE CRÉDITO REPORTADA POR LA EMISORA DE TARJETA DE CRÉDITO, SOLO RECAP 0% (332H)",,tax_group_purchase,pc,percentage,Decimal('0.0'),pc_20107010256,pc_20107010256,taxcode_1030123,,taxcode_1030123,,1,1,-1,-1,
tax_333,"ENAJENACIÓN DE DERECHOS REPRESENTATIVOS DE CAPITAL Y OTROS DERECHOS COTIZADOS EN BOLSA ECUATORIANA 0,20% (333)",,tax_group_purchase,pc,percentage,Decimal('-0.20'),pc_20107010257,pc_20107010257,taxcode_1030124,taxcode_1030161,taxcode_1030124,taxcode_1030161,1,1,-1,-1,
tax_334,ENAJENACIÓN DE DERECHOS REPRESENTATIVOS DE CAPITAL Y OTROS DERECHOS NO COTIZADOS EN BOLSA ECUATORIANA 1% (334),,tax_group_purchase,pc,percentage,Decimal('-1.0'),pc_20107010258,pc_20107010258,taxcode_1030125,taxcode_1030162,taxcode_1030125,taxcode_1030162,1,1,-1,-1,
tax_335,"POR LOTERÍAS, RIFAS, APUESTAS Y SIMILARES 15% (335)",,tax_group_purchase,pc,percentage,Decimal('-15.0'),pc_20107010259,pc_20107010259,taxcode_1030126,taxcode_1030163,taxcode_1030126,taxcode_1030163,1,1,-1,-1,
tax_336,POR VENTA DE COMBUSTIBLES A COMERCIALIZADORAS  2/MIL (336),,tax_group_purchase,pc,percentage,Decimal('-0.002'),pc_20107010260,pc_20107010260,taxcode_1030127,taxcode_1030164,taxcode_1030127,taxcode_1030164,1,1,-1,-1,
tax_337,POR VENTA DE COMBUSTIBLES A DISTRIBUIDORES 3/MIL(337),,tax_group_purchase,pc,percentage,Decimal('-0.003'),pc_20107010261,pc_20107010261,taxcode_1030128,taxcode_1030165,taxcode_1030128,taxcode_1030165,1,1,-1,-1,
tax_338,COMPRA LOCAL DE BANANO A PRODUCTOR 1% - 2% (338),,tax_group_purchase,pc,percentage,Decimal('-1.0'),pc_20107010262,pc_20107010262,taxcode_1030129,taxcode_1030166,taxcode_1030129,taxcode_1030166,1,1,-1,-1,
tax_339,LIQUIDACIÓN IMPUESTO ÚNICO A LA VENTA LOCAL DE BANANO DE PRODUCCIÓN PROPIA HASTA EL 100% (339),,tax_group_purchase,pc,percentage,Decimal('-1.0'),pc_20107010263,pc_20107010263,taxcode_1030130,taxcode_1030167,taxcode_1030130,taxcode_1030167,1,1,-1,-1,
tax_340,IMPUESTO ÚNICO A LA EXPORTACIÓN DE BANANO DE PRODUCCIÓN PROPIA - COMPONENTE 1      1% -2% (340) ,,tax_group_purchase,pc,percentage,Decimal('-1.0'),pc_20107010264,pc_20107010264,taxcode_1030131,taxcode_1030168,taxcode_1030131,taxcode_1030168,1,1,-1,-1,
tax_341,"IMPUESTO ÚNICO A LA EXPORTACIÓN DE BANANO DE PRODUCCIÓN PROPIA - COMPONENTE 2        1,25% - 2% (341)",,tax_group_purchase,pc,percentage,Decimal('-1.25'),pc_20107010265,pc_20107010265,taxcode_1030132,taxcode_1030169,taxcode_1030132,taxcode_1030169,1,1,-1,-1,
tax_342,"IMPUESTO ÚNICO A LA EXPORTACIÓN DE BANANO PRODUCIDO POR TERCEROS 0,5%-2%  (342)",,tax_group_purchase,pc,percentage,Decimal('-0.5'),pc_20107010266,pc_20107010266,taxcode_1030133,taxcode_1030170,taxcode_1030133,taxcode_1030170,1,1,-1,-1,
tax_343A,POR ENERGÍA ELÉCTRICA  1% (343A),,tax_group_purchase,pc,percentage,Decimal('-1.0'),pc_20107010267,pc_20107010267,taxcode_1030134,taxcode_1030171,taxcode_1030134,taxcode_1030171,1,1,-1,-1,
tax_343B,"POR ACTIVIDADES DE CONSTRUCCIÓN DE OBRA MATERIAL INMUEBLE, URBANIZACIÓN, LOTIZACIÓN O ACTIVIDADES SIMILARES   1% (343B)",,tax_group_purchase,pc,percentage,Decimal('-1.0'),pc_20107010268,pc_20107010268,taxcode_1030134,taxcode_1030171,taxcode_1030134,taxcode_1030171,1,1,-1,-1,
tax_344,OTRAS RETENCIONES APLICABLES EL 2% (344),,tax_group_purchase,pc,percentage,Decimal('-2.0'),pc_20107010269,pc_20107010269,taxcode_1030135,taxcode_1030172,taxcode_1030135,taxcode_1030172,1,1,-1,-1,
tax_344A,"PAGO LOCAL TARJETA DE CRÉDITO REPORTADA POR LA EMISORA DE TARJETA DE CRÉDITO, SOLO RECAP  2% (344A)",,tax_group_purchase,pc,percentage,Decimal('-2.0'),pc_20107010270,pc_20107010270,taxcode_1030135,taxcode_1030172,taxcode_1030135,taxcode_1030172,1,1,-1,-1,
tax_345,OTRAS RETENCIONES APLICABLES EL 8% (345),,tax_group_purchase,pc,percentage,Decimal('-8.0'),pc_20107010271,pc_20107010271,taxcode_1030136,taxcode_1030173,taxcode_1030136,taxcode_1030173,1,1,-1,-1,
tax_346A,GANANCIAS DE CAPITAL    (ENTRE 0 Y 10)    (346A),,tax_group_purchase,pc,percentage,Decimal('-0.1'),pc_20107010272,pc_20107010272,taxcode_1030137,taxcode_1030174,taxcode_1030137,taxcode_1030174,1,1,-1,-1,
tax_500,PAGO AL EXTERIOR - RENTAS INMOBILIARIAS  (ENTRE 0 Y 22 * ) (500),,tax_group_purchase,pc,percentage,Decimal('-0.1'),pc_20107010273,pc_20107010273,,,,,1,1,-1,-1,
tax_501,PAGO AL EXTERIOR - BENEFICIOS EMPRESARIALES (ENTRE 0 Y 22 * )  (501),,tax_group_purchase,pc,percentage,Decimal('-0.1'),pc_20107010274,pc_20107010274,,,,,1,1,-1,-1,
tax_502,PAGO AL EXTERIOR - SERVICIOS EMPRESARIALES  (ENTRE 0 Y 22 * )  (502),,tax_group_purchase,pc,percentage,Decimal('-0.1'),pc_20107010275,pc_20107010275,,,,,1,1,-1,-1,
tax_503,PAGO AL EXTERIOR - NAVEGACIÓN MARÍTIMA Y/O AÉREA  (ENTRE 0 Y 22 * )  (503),,tax_group_purchase,pc,percentage,Decimal('-0.1'),pc_20107010276,pc_20107010276,,,,,1,1,-1,-1,
tax_504,PAGO AL EXTERIOR- DIVIDENDOS DISTRIBUIDOS A PERSONAS NATURALES 0% (504),,tax_group_purchase,pc,percentage,Decimal('0.0'),pc_20107010277,pc_20107010277,,,,,1,1,-1,-1,
tax_504A,PAGO AL EXTERIOR - DIVIDENDOS A SOCIEDADES  HASTA EL 100% (504A),,tax_group_purchase,pc,,Decimal('-0.1'),pc_20107010278,pc_20107010278,,,,,1,1,-1,-1,
tax_504B,PAGO AL EXTERIOR - ANTICIPO DIVIDENDOS  22% (504B),,tax_group_purchase,pc,percentage,Decimal('-22.0'),pc_20107010279,pc_20107010279,,,,,1,1,-1,-1,
tax_504C,"PAGO AL EXTERIOR - DIVIDENDOS ANTICIPADOS PRÉSTAMOS ACCIONISTAS, BENEFICIARIOS O PARTÌCIPES  HASTA EL 100% (504C)",,tax_group_purchase,pc,percentage,Decimal('-0.1'),pc_20107010280,pc_20107010280,,,,,1,1,-1,-1,
tax_504D,PAGO AL EXTERIOR - DIVIDENDOS A FIDEICOMISOS HASTA EL 100% (504D),,tax_group_purchase,pc,percentage,Decimal('-0.1'),pc_20107010281,pc_20107010281,,,,,1,1,-1,-1,
tax_504E,PAGO AL EXTERIOR- DIVIDENDOS DISTRIBUIDOS A PERSONAS NATURALES (PARAÍSOS FISCALES) 0% (504E),,tax_group_purchase,pc,percentage,Decimal('0.0'),pc_20107010282,pc_20107010282,,,,,1,1,-1,-1,
tax_504F,PAGO AL EXTERIOR - DIVIDENDOS A SOCIEDADES  (PARAÍSOS FISCALES)  13%(504F),,tax_group_purchase,pc,percentage,Decimal('-13.0'),pc_20107010283,pc_20107010283,,,,,1,1,-1,-1,
